{"schema_version":"aud-verification-case-v1","case_id":"VC-EXAMPLE-001","remediation_id":"R-CONTEXT-001","finding_id":"F-2026-09-04-flow-001","cluster_refs":["CLUSTER-CONTEXT-001"],"original_evidence_refs":["EV-014"],"acceptance_criteria":[{"id":"AC-001","statement":"State restores."}],"verification_methods":[{"instrument":"browser","procedure":"Replay return path."}],"method_categories":["browser_interaction"],"targets":{"routes":["/compare"],"states":["source-selected"],"tasks":["TASK-03"],"components":["EvidenceLink"],"content":[]},"required_fixtures":["mature"],"required_environment":{"browser":"chromium"},"prerequisites":[],"expected_result":"State restores.","regression_scope":["/compare"],"readiness":{"state":"ready","reasons":[]},"execution_status":"ready"}
